{
  "$schema": "https://json-schema.org/draft/2020-12/schema",
  "$id": "https://opencity.local/contracts/approved-script.schema.json",
  "title": "Approved voice timeline",
  "type": "array",
  "minItems": 1,
  "items": {
    "type": "object",
    "required": ["time", "speaker", "text"],
    "properties": {
      "time": {"type": "string", "pattern": "^[0-9]+:[0-5][0-9]-[0-9]+:[0-5][0-9]$"},
      "speaker": {"type": "string", "minLength": 1},
      "text": {"type": "string", "minLength": 1},
      "sfx": {"type": "array", "items": {"type": "string"}}
    },
    "additionalProperties": true
  }
}
